[
  {
    "authors_or_institution": "A",
    "confidence": "high",
    "derivation": "d",
    "derived_annualized_pp": 0.96,
    "geography": "argentina",
    "geography_detail": null,
    "horizon_end_year": 2036,
    "horizon_start_year": 2026,
    "id": "a0",
    "key_assumptions": null,
    "locator": null,
    "mapping_rationale": null,
    "method": "expert_judgment",
    "outcome_metric": "tfp_level_gain_pct_cumulative",
    "publication_date": "2026-01-01",
    "publisher_type": "peer_reviewed",
    "record_type": "projection",
    "retrieved_at": "2026-10-02",
    "scenario_by_source": null,
    "scenario_mapping": "not_stated",
    "snippet": null,
    "source": "MOCK",
    "source_id": "mock:M000",
    "source_url": null,
    "sponsor_conflict_note": "C1",
    "time_profile": "linear",
    "title": "T",
    "unit": "pct",
    "value": 10.0,
    "value_high": null,
    "value_low": null
  },
  {
    "authors_or_institution": "A",
    "confidence": "high",
    "derivation": "d",
    "derived_annualized_pp": 0.96,
    "geography": "global",
    "geography_detail": null,
    "horizon_end_year": 2036,
    "horizon_start_year": 2026,
    "id": "a1",
    "key_assumptions": null,
    "locator": null,
    "mapping_rationale": null,
    "method": "expert_judgment",
    "outcome_metric": "tfp_level_gain_pct_cumulative",
    "publication_date": "2026-01-01",
    "publisher_type": "consultancy",
    "record_type": "projection",
    "retrieved_at": "2026-10-02",
    "scenario_by_source": null,
    "scenario_mapping": "not_stated",
    "snippet": null,
    "source": "MOCK",
    "source_id": "mock:M001",
    "source_url": null,
    "sponsor_conflict_note": "C2",
    "time_profile": "linear",
    "title": "T",
    "unit": "pct",
    "value": 10.0,
    "value_high": null,
    "value_low": null
  },
  {
    "authors_or_institution": "A",
    "confidence": "high",
    "derivation": "d",
    "derived_annualized_pp": 0.96,
    "geography": "us",
    "geography_detail": null,
    "horizon_end_year": 2036,
    "horizon_start_year": 2026,
    "id": "a2",
    "key_assumptions": null,
    "locator": null,
    "mapping_rationale": null,
    "method": "expert_judgment",
    "outcome_metric": "tfp_level_gain_pct_cumulative",
    "publication_date": "2026-01-01",
    "publisher_type": "think_tank",
    "record_type": "projection",
    "retrieved_at": "2026-10-02",
    "scenario_by_source": null,
    "scenario_mapping": "not_stated",
    "snippet": null,
    "source": "MOCK",
    "source_id": "mock:M002",
    "source_url": null,
    "sponsor_conflict_note": null,
    "time_profile": "linear",
    "title": "T",
    "unit": "pct",
    "value": 10.0,
    "value_high": null,
    "value_low": null
  },
  {
    "authors_or_institution": "A",
    "confidence": "high",
    "derivation": "d",
    "derived_annualized_pp": 0.96,
    "geography": "argentina",
    "geography_detail": null,
    "horizon_end_year": 2036,
    "horizon_start_year": 2026,
    "id": "a3",
    "key_assumptions": null,
    "locator": null,
    "mapping_rationale": null,
    "method": "expert_judgment",
    "outcome_metric": "tfp_level_gain_pct_cumulative",
    "publication_date": "2026-01-01",
    "publisher_type": "peer_reviewed",
    "record_type": "projection",
    "retrieved_at": "2026-10-02",
    "scenario_by_source": null,
    "scenario_mapping": "not_stated",
    "snippet": null,
    "source": "MOCK",
    "source_id": "mock:M003",
    "source_url": null,
    "sponsor_conflict_note": null,
    "time_profile": "linear",
    "title": "T",
    "unit": "pct",
    "value": 10.0,
    "value_high": null,
    "value_low": null
  },
  {
    "authors_or_institution": "A",
    "confidence": "high",
    "derivation": "d",
    "derived_annualized_pp": 0.96,
    "geography": "global",
    "geography_detail": null,
    "horizon_end_year": 2036,
    "horizon_start_year": 2026,
    "id": "a4",
    "key_assumptions": null,
    "locator": null,
    "mapping_rationale": null,
    "method": "expert_judgment",
    "outcome_metric": "tfp_level_gain_pct_cumulative",
    "publication_date": "2026-01-01",
    "publisher_type": "consultancy",
    "record_type": "projection",
    "retrieved_at": "2026-10-02",
    "scenario_by_source": null,
    "scenario_mapping": "not_stated",
    "snippet": null,
    "source": "MOCK",
    "source_id": "mock:M004",
    "source_url": null,
    "sponsor_conflict_note": null,
    "time_profile": "linear",
    "title": "T",
    "unit": "pct",
    "value": 10.0,
    "value_high": null,
    "value_low": null
  },
  {
    "authors_or_institution": "A",
    "confidence": "high",
    "derivation": "d",
    "derived_annualized_pp": 0.96,
    "geography": "us",
    "geography_detail": null,
    "horizon_end_year": 2036,
    "horizon_start_year": 2026,
    "id": "a5",
    "key_assumptions": null,
    "locator": null,
    "mapping_rationale": null,
    "method": "expert_judgment",
    "outcome_metric": "tfp_level_gain_pct_cumulative",
    "publication_date": "2026-01-01",
    "publisher_type": "think_tank",
    "record_type": "projection",
    "retrieved_at": "2026-10-02",
    "scenario_by_source": null,
    "scenario_mapping": "not_stated",
    "snippet": null,
    "source": "MOCK",
    "source_id": "mock:M005",
    "source_url": null,
    "sponsor_conflict_note": null,
    "time_profile": "linear",
    "title": "T",
    "unit": "pct",
    "value": 10.0,
    "value_high": null,
    "value_low": null
  },
  {
    "authors_or_institution": "A",
    "confidence": "high",
    "derivation": null,
    "derived_annualized_pp": null,
    "geography": "argentina",
    "geography_detail": null,
    "horizon_end_year": 2036,
    "horizon_start_year": 2026,
    "id": "a_pes",
    "key_assumptions": null,
    "locator": null,
    "mapping_rationale": "r",
    "method": "expert_judgment",
    "outcome_metric": "tfp_level_gain_pct_cumulative",
    "publication_date": "2026-01-01",
    "publisher_type": "consultancy",
    "record_type": "projection",
    "retrieved_at": "2026-10-02",
    "scenario_by_source": null,
    "scenario_mapping": "pessimistic",
    "snippet": null,
    "source": "MOCK",
    "source_id": "mock:M_pes",
    "source_url": null,
    "sponsor_conflict_note": null,
    "time_profile": "linear",
    "title": "T",
    "unit": "pct",
    "value": 1.0,
    "value_high": 1.5,
    "value_low": 0.5
  },
  {
    "authors_or_institution": "A",
    "confidence": "high",
    "derivation": null,
    "derived_annualized_pp": null,
    "geography": "argentina",
    "geography_detail": null,
    "horizon_end_year": 2036,
    "horizon_start_year": 2026,
    "id": "a_opt",
    "key_assumptions": null,
    "locator": null,
    "mapping_rationale": "r",
    "method": "expert_judgment",
    "outcome_metric": "tfp_level_gain_pct_cumulative",
    "publication_date": "2026-01-01",
    "publisher_type": "consultancy",
    "record_type": "projection",
    "retrieved_at": "2026-10-02",
    "scenario_by_source": null,
    "scenario_mapping": "optimistic",
    "snippet": null,
    "source": "MOCK",
    "source_id": "mock:M_opt",
    "source_url": null,
    "sponsor_conflict_note": null,
    "time_profile": "linear",
    "title": "T",
    "unit": "pct",
    "value": 6.0,
    "value_high": 7.0,
    "value_low": 5.0
  },
  {
    "authors_or_institution": "A",
    "confidence": "high",
    "derivation": null,
    "derived_annualized_pp": null,
    "geography": "argentina",
    "geography_detail": null,
    "horizon_end_year": 2036,
    "horizon_start_year": 2026,
    "id": "a_exp",
    "key_assumptions": null,
    "locator": null,
    "mapping_rationale": "r",
    "method": "expert_judgment",
    "outcome_metric": "tfp_level_gain_pct_cumulative",
    "publication_date": "2026-01-01",
    "publisher_type": "consultancy",
    "record_type": "projection",
    "retrieved_at": "2026-10-02",
    "scenario_by_source": null,
    "scenario_mapping": "expected",
    "snippet": null,
    "source": "MOCK",
    "source_id": "mock:M_exp",
    "source_url": null,
    "sponsor_conflict_note": null,
    "time_profile": "linear",
    "title": "T",
    "unit": "pct",
    "value": 3.0,
    "value_high": null,
    "value_low": null
  },
  {
    "authors_or_institution": "A",
    "confidence": "high",
    "derivation": null,
    "derived_annualized_pp": null,
    "geography": "global",
    "geography_detail": null,
    "horizon_end_year": 2025,
    "horizon_start_year": 2020,
    "id": "a_obs0",
    "key_assumptions": null,
    "locator": null,
    "mapping_rationale": null,
    "method": "expert_judgment",
    "outcome_metric": "tfp_growth_pp_per_year",
    "publication_date": "2026-01-01",
    "publisher_type": "consultancy",
    "record_type": "observed",
    "retrieved_at": "2026-10-02",
    "scenario_by_source": null,
    "scenario_mapping": "not_stated",
    "snippet": null,
    "source": "MOCK",
    "source_id": "mock:M_obs0",
    "source_url": null,
    "sponsor_conflict_note": null,
    "time_profile": "linear",
    "title": "T",
    "unit": "pp",
    "value": 0.5,
    "value_high": null,
    "value_low": null
  },
  {
    "authors_or_institution": "A",
    "confidence": "high",
    "derivation": null,
    "derived_annualized_pp": null,
    "geography": "global",
    "geography_detail": null,
    "horizon_end_year": 2025,
    "horizon_start_year": 2020,
    "id": "a_obs1",
    "key_assumptions": null,
    "locator": null,
    "mapping_rationale": null,
    "method": "expert_judgment",
    "outcome_metric": "tfp_growth_pp_per_year",
    "publication_date": "2026-01-01",
    "publisher_type": "consultancy",
    "record_type": "observed",
    "retrieved_at": "2026-10-02",
    "scenario_by_source": null,
    "scenario_mapping": "not_stated",
    "snippet": null,
    "source": "MOCK",
    "source_id": "mock:M_obs1",
    "source_url": null,
    "sponsor_conflict_note": null,
    "time_profile": "linear",
    "title": "T",
    "unit": "pp",
    "value": 0.5,
    "value_high": null,
    "value_low": null
  },
  {